URL	Title
https://www.youtube.com/watch?v=sTeoEFzVNSc	ChatGPT Tutorial for Developers - 38 Ways to 10x Your Productivity	3590831
https://www.youtube.com/watch?v=_ZvnD73m40o	Prompt Engineering Tutorial – Master ChatGPT and LLM Responses	2026973
https://www.youtube.com/watch?v=O-Vu-DMIU40	OpenAI launches "genius" o4 model with a programming CLI tool...	919541
https://www.youtube.com/watch?v=o9sSitOTPhg	ChatGPT Tutorial  - How to Code using ChatGPT | How to use ChatGPT for Coding | Intellipaat	760231
https://www.youtube.com/watch?v=zIWqTJu9HaA	Actually, ChatGPT is INCREDIBLY Useful (15 Surprising Examples)	688557
https://www.youtube.com/watch?v=zWi_N_sU0uk	Roasting Developers by Programming Language 🔥🧑‍💻	278775
https://www.youtube.com/watch?v=LjL3J_TLt08	Google just destroyed all vibe-coding apps (Firebase Studio)	249598
https://www.youtube.com/watch?v=dJhlMn2otxA	Learn to Code using AI - ChatGPT Programming Tutorial (Full Course)	236905
https://www.youtube.com/watch?v=eNIL0TsVoVk	Learn almost any programming languages #coding #programming #webdevelopment	193295
https://www.youtube.com/watch?v=koybBUxiKW0	How ChatGPT makes my Coding Life 10x Easier (Tutorial)	166287
https://www.youtube.com/watch?v=FF_HzfqxS2o	ChatGPT Code Interpreter Tutorial - New Open AI GPT Model!	153181
https://www.youtube.com/watch?v=sbfdzF8X-AQ	How to Write Code With ChatGPT	70490
https://www.youtube.com/watch?v=pkKQBhQyUyQ	How to learn to code FAST using ChatGPT (it's a game changer seriously)	70075
https://www.youtube.com/watch?v=PmCJoMX6KSo	ChatGPT in VSCode 🤯 - Your 10x Coding Partner (Tutorial)	62265
https://www.youtube.com/watch?v=Qf5AKsCY2Nc	ChatGPT Just Changed How You'll Write And Code (Save Hours Instantly!) - ChatGPT Canvas	52907
https://www.youtube.com/watch?v=4uxCQisgefc	How To Use Chat GPT To Write Code (Tutorial For Beginners)	51663
https://www.youtube.com/watch?v=Y2M9RRnVTcc	ChatGPT Tutorial for Developers | How to use ChatGPT for Coding (Python, JavaScript, HTML) | Edureka	27978
https://www.youtube.com/watch?v=rHiiYMVU_ok	How to write Arduino code with ChatGPT - (Full Guide)	24848
https://www.youtube.com/watch?v=QVmQBU6_m6o	How to Use ChatGPT to Write 10X Code - My Workflow (Tutorial)	24156
https://www.youtube.com/watch?v=7I0BJyebaek	How to Code with ChatGPT: Complete Guide for Beginners to Advanced Programmers	22504
https://www.youtube.com/watch?v=m5A8_rNEDDk	ChatGPT Tutorial for Developers | How to use ChatGPT for Coding (Python, JavaScript, HTML) | Edureka	17807
https://www.youtube.com/watch?v=borgbZTWIvo	CHATGPT RELEASES A CODING BUDDY! FULL BEGINNER’S GUIDE	13275
https://www.youtube.com/watch?v=2nCqFnsEhB4	ChatGPT Tutorial for Developers | How to use ChatGPT for Coding (Python, JavaScript, HTML) | Edureka	8839
https://www.youtube.com/watch?v=U_zJrPizCTA	ChatGPT Tutorial for Developers | How to use ChatGPT for Coding  | Edureka  Rewind	6095
https://www.youtube.com/watch?v=RamREwiB-B8	How to Interface a Tilt Switch with Arduino: ChatGPT Generated Code Tutorial	5331
https://www.youtube.com/watch?v=GVIWrMgP6Yo	How To Code a Web App With ChatGPT (Tutorial For Beginners!)	4577
https://www.youtube.com/watch?v=fBxtDXPhkok	Advanced ChatGPT Tutorial: Python Coding!	3320
https://www.youtube.com/watch?v=CXBKQ4VTuKY	#shorts #chatgpt #ai #chatbot #money #coding #howto #tutorial	3058
https://www.youtube.com/watch?v=yk_F6VTzcF4	Solving Complex Coding Problems: A Step-by-Step Guide with ChatGPT	2102
https://www.youtube.com/watch?v=Bw-M9w4w6e4	ChatGPT Code Interpreter - Complete Tutorial	1435
https://www.youtube.com/watch?v=4kj0r_O1ecE	ChatGPT Coding Tutorial - A Crash Course on ChatGPT Coding for Beginners	1294
https://www.youtube.com/watch?v=oG4yvBmZ1WU	Design Stunning App UI with ChatGPT in SECONDS! (No Code, No Figma)	1220
https://www.youtube.com/watch?v=ykrfojmpfwA	How to use ChatGPT Canvas for Coding - FULL TUTORIAL	1132
https://www.youtube.com/watch?v=SJwlV4DJ88Y	Grok Studio: Full Guide to Code Execution, Google Drive Support-Best FREE AI Coder |  290	298
https://www.youtube.com/watch?v=ByA6_15jIpE	Quick, easy SQL with ChatGPT! #coding #sqlqueries #tutorial #databasemanagement #chatgpt	279
https://www.youtube.com/watch?v=2iKNAfGBaUs	ChatGpt: loop through list in python tutorial #chatgpt #coding #programming #python #chat	180
https://www.youtube.com/watch?v=FRcvX4e_HcI	Boost Your Coding Skills with ChatGPT: A Must-Watch Tutorial	169
https://www.youtube.com/watch?v=pvAQMHBYCVM	ChatGPT HOW TO USE | ChatGPT 4 | ChatGPT Tutorial #chatgpt #tutorial #coding #programming	97
https://www.youtube.com/watch?v=hEk_AH4Yppg	chat GPT Build website easy money making #code #coding #gpt #tutorial #gpt4 #code	82
https://www.youtube.com/watch?v=oyEZqI3q0xM	ChatGPT plugins: Code Interpreter Plugin a Comprehensive Guide With Examples Showcase	67
https://www.youtube.com/watch?v=tkvhzXLc4Tk	Textfield with Validation , Gradient background  #coding #flutter #tutorial	63
https://www.youtube.com/watch?v=LGpcPknv3vY	Chat with PDF tutorial #python #coding #javascript #html #youtubeshorts  #ai #chatgpt #openai	45
https://www.youtube.com/watch?v=Jye2OABbHDk	Master Coding with ChatGPT: Beginner’s Guide to AI-Powered Programming!	37
https://www.youtube.com/watch?v=FcGfju3ra4U	Mastering coding for an absolute beginner through Chat GPT: Tutorial	33
https://www.youtube.com/watch?v=5pzCFFNTUK4	How to access internet using ChatGPT #coding #gpt #ainews #googlebar #tutorial #googleai #google	20
https://www.youtube.com/watch?v=0f3VjHf2azI	Local AI in under a minute  #chatgpt  #coding  #tutorial  #howto  #windows  #tech	19
https://www.youtube.com/watch?v=nlYiKfsls00	Transform ChatGPT into Your Coding Tutor | Quick Tech Guide	14
https://www.youtube.com/watch?v=no23LyW1nso	How To Use ChatGPT For Coding Tutorial	6
https://www.youtube.com/watch?v=PTlT6kbyAuw	✅ How To Use ChatGPT To Write Code (Full Guide)	6
https://www.youtube.com/watch?v=wc8J65aH6yg	#chatgpt #aiwebsites #tech #tutorial #coding #passiveincome #googleaistudio	0
